{
  "contractVersion": "2.0",
  "externalOperationId": "2001",
  "operationKey": "reserve:2000:member-set-A",
  "providerProfileId": "REFERENCE-CAPACITY-2.0",
  "requestHash": "bbbbbbbbbbbbbbbbbbbbbbbbbbbbbbbbbbbbbbbbbbbbbbbbbbbbbbbbbbbbbbbb",
  "outcome": "Unknown",
  "effectRef": null,
  "targetResults": [
    {
      "targetRef": "SERVICE-A",
      "outcome": "Unknown",
      "resourceRef": null,
      "resourceState": null,
      "confirmedQuantity": null,
      "sourceVersion": null,
      "reasonCode": null
    }
  ],
  "sourceRevision": null,
  "occurredAt": null,
  "observedAt": "2026-10-01T10:00:00Z",
  "evidenceRef": "REFERENCE-EVIDENCE-A",
  "evidenceHash": "cccccccccccccccccccccccccccccccccccccccccccccccccccccccccccccccc",
  "reasons": [
    "ResponseLostAfterDispatch"
  ],
  "hasUnknown": true
}

