{
  "contractVersion": "2.0",
  "externalOperationId": "2001",
  "operationKey": "reserve:2000:member-set-A",
  "providerProfileId": "REFERENCE-CAPACITY-2.0",
  "requestHash": "bbbbbbbbbbbbbbbbbbbbbbbbbbbbbbbbbbbbbbbbbbbbbbbbbbbbbbbbbbbbbbbb",
  "outcome": "Confirmed",
  "effectRef": "OWNER-EFFECT-A",
  "targetResults": [
    {
      "targetRef": "SERVICE-A",
      "outcome": "Confirmed",
      "resourceRef": "OWNER-HOLD-A",
      "resourceState": "Held",
      "confirmedQuantity": "1",
      "sourceVersion": "1",
      "reasonCode": null
    }
  ],
  "sourceRevision": "1",
  "occurredAt": "2026-10-01T10:00:00Z",
  "observedAt": "2026-10-01T10:00:00Z",
  "evidenceRef": "REFERENCE-EVIDENCE-A",
  "evidenceHash": "cccccccccccccccccccccccccccccccccccccccccccccccccccccccccccccccc",
  "reasons": [],
  "hasUnknown": false
}

